{
  "$schema": "https://json-schema.org/draft/2020-12/schema",
  "$id": "local-reality-body.epistemic-index.v0.2",
  "type": "object",
  "required": ["schema", "body_id", "represented_currentness_revision", "admitted_records", "source_relations", "observations", "evidence", "inferences", "working_interpretations", "consequence_observations", "standing_claims", "explicit_non_admissions"],
  "properties": {
    "schema": {"const": "local-reality-body.epistemic-index.v0.2"},
    "body_id": {"const": "RM-LOCAL-REALITY-BODY-001"},
    "represented_currentness_revision": {"const": 4},
    "admitted_records": {"type": "array"},
    "source_relations": {"type": "array"},
    "observations": {"type": "array"},
    "evidence": {"type": "array"},
    "inferences": {"type": "array"},
    "working_interpretations": {"type": "array"},
    "consequence_observations": {"type": "array"},
    "standing_claims": {"type": "array"},
    "explicit_non_admissions": {"type": "array", "items": {"type": "string"}, "uniqueItems": true}
  },
  "additionalProperties": false
}
